{
  "schemaVersion": "1.0.0",
  "datasetVersion": "2026.08.1",
  "synthetic": false,
  "review": {
    "editorId": "studentos-content-editor",
    "reviewerId": "studentos-content-reviewer",
    "reviewedAt": "2026-08-26T00:00:00Z",
    "rationale": "Role activities and technology coverage were cross-checked against O*NET occupation profiles and India NCO classifications. Skill depths and effort estimates are StudentOS planning parameters, not claims made by those sources."
  },
  "skills": [
    {
      "key": "programming.fundamentals",
      "name": "Programming fundamentals",
      "category": "PROGRAMMING",
      "rubricVersion": 1,
      "evidenceDecayDays": 730,
      "prerequisites": []
    },
    {
      "key": "programming.oop",
      "name": "Object-oriented programming",
      "category": "PROGRAMMING",
      "rubricVersion": 1,
      "evidenceDecayDays": 730,
      "prerequisites": [
        {
          "skillKey": "programming.fundamentals",
          "type": "HARD",
          "threshold": 0.4
        }
      ]
    },
    {
      "key": "dsa.core",
      "name": "Data structures and algorithms",
      "category": "DSA",
      "rubricVersion": 1,
      "evidenceDecayDays": 730,
      "prerequisites": [
        {
          "skillKey": "programming.fundamentals",
          "type": "HARD",
          "threshold": 0.4
        }
      ]
    },
    {
      "key": "dsa.problem-solving",
      "name": "Algorithmic problem solving",
      "category": "DSA",
      "rubricVersion": 1,
      "evidenceDecayDays": 730,
      "prerequisites": [
        {
          "skillKey": "dsa.core",
          "type": "HARD",
          "threshold": 0.5
        }
      ]
    },
    {
      "key": "core.os",
      "name": "Operating systems",
      "category": "CORE_CS",
      "rubricVersion": 1,
      "evidenceDecayDays": 730,
      "prerequisites": [
        {
          "skillKey": "programming.fundamentals",
          "type": "SOFT",
          "threshold": 0.3
        }
      ]
    },
    {
      "key": "core.networks",
      "name": "Computer networks",
      "category": "CORE_CS",
      "rubricVersion": 1,
      "evidenceDecayDays": 730,
      "prerequisites": []
    },
    {
      "key": "db.relational",
      "name": "Relational databases and SQL",
      "category": "DATABASES",
      "rubricVersion": 1,
      "evidenceDecayDays": 730,
      "prerequisites": [
        {
          "skillKey": "programming.fundamentals",
          "type": "SOFT",
          "threshold": 0.3
        }
      ]
    },
    {
      "key": "engineering.software",
      "name": "Software engineering practices",
      "category": "DEVELOPMENT",
      "rubricVersion": 1,
      "evidenceDecayDays": 365,
      "prerequisites": [
        {
          "skillKey": "programming.oop",
          "type": "SOFT",
          "threshold": 0.4
        }
      ]
    },
    {
      "key": "engineering.testing",
      "name": "Automated testing and debugging",
      "category": "DEVELOPMENT",
      "rubricVersion": 1,
      "evidenceDecayDays": 365,
      "prerequisites": [
        {
          "skillKey": "programming.fundamentals",
          "type": "HARD",
          "threshold": 0.4
        }
      ]
    },
    {
      "key": "tools.git",
      "name": "Git and collaborative version control",
      "category": "TOOLS",
      "rubricVersion": 1,
      "evidenceDecayDays": 365,
      "prerequisites": []
    },
    {
      "key": "web.fundamentals",
      "name": "HTML, CSS, and browser fundamentals",
      "category": "DEVELOPMENT",
      "rubricVersion": 1,
      "evidenceDecayDays": 365,
      "prerequisites": []
    },
    {
      "key": "web.javascript",
      "name": "Modern JavaScript and TypeScript",
      "category": "PROGRAMMING",
      "rubricVersion": 1,
      "evidenceDecayDays": 730,
      "prerequisites": [
        {
          "skillKey": "programming.fundamentals",
          "type": "HARD",
          "threshold": 0.4
        }
      ]
    },
    {
      "key": "web.react",
      "name": "React user-interface development",
      "category": "DEVELOPMENT",
      "rubricVersion": 1,
      "evidenceDecayDays": 365,
      "prerequisites": [
        {
          "skillKey": "web.javascript",
          "type": "HARD",
          "threshold": 0.5
        },
        {
          "skillKey": "web.fundamentals",
          "type": "HARD",
          "threshold": 0.4
        }
      ]
    },
    {
      "key": "backend.api",
      "name": "HTTP and REST API engineering",
      "category": "DEVELOPMENT",
      "rubricVersion": 1,
      "evidenceDecayDays": 365,
      "prerequisites": [
        {
          "skillKey": "core.networks",
          "type": "SOFT",
          "threshold": 0.3
        },
        {
          "skillKey": "programming.fundamentals",
          "type": "HARD",
          "threshold": 0.5
        }
      ]
    },
    {
      "key": "backend.security",
      "name": "Application security fundamentals",
      "category": "CORE_CS",
      "rubricVersion": 1,
      "evidenceDecayDays": 730,
      "prerequisites": [
        {
          "skillKey": "backend.api",
          "type": "SOFT",
          "threshold": 0.4
        }
      ]
    },
    {
      "key": "deployment.devops",
      "name": "CI/CD, containers, and deployment",
      "category": "TOOLS",
      "rubricVersion": 1,
      "evidenceDecayDays": 365,
      "prerequisites": [
        {
          "skillKey": "tools.git",
          "type": "HARD",
          "threshold": 0.4
        },
        {
          "skillKey": "engineering.testing",
          "type": "SOFT",
          "threshold": 0.4
        }
      ]
    },
    {
      "key": "data.python",
      "name": "Python for data work",
      "category": "DATA",
      "rubricVersion": 1,
      "evidenceDecayDays": 365,
      "prerequisites": [
        {
          "skillKey": "programming.fundamentals",
          "type": "HARD",
          "threshold": 0.4
        }
      ]
    },
    {
      "key": "data.statistics",
      "name": "Applied statistics",
      "category": "DATA",
      "rubricVersion": 1,
      "evidenceDecayDays": 365,
      "prerequisites": []
    },
    {
      "key": "data.analysis",
      "name": "Data cleaning and analysis",
      "category": "DATA",
      "rubricVersion": 1,
      "evidenceDecayDays": 365,
      "prerequisites": [
        {
          "skillKey": "data.python",
          "type": "HARD",
          "threshold": 0.4
        },
        {
          "skillKey": "db.relational",
          "type": "SOFT",
          "threshold": 0.4
        },
        {
          "skillKey": "data.statistics",
          "type": "HARD",
          "threshold": 0.4
        }
      ]
    },
    {
      "key": "data.visualization",
      "name": "Data visualization and reporting",
      "category": "DATA",
      "rubricVersion": 1,
      "evidenceDecayDays": 365,
      "prerequisites": [
        {
          "skillKey": "data.analysis",
          "type": "HARD",
          "threshold": 0.5
        }
      ]
    },
    {
      "key": "communication.technical",
      "name": "Technical communication",
      "category": "COMMUNICATION",
      "rubricVersion": 1,
      "evidenceDecayDays": 730,
      "prerequisites": []
    },
    {
      "key": "projects.delivery",
      "name": "Portfolio project delivery",
      "category": "PROJECTS",
      "rubricVersion": 1,
      "evidenceDecayDays": 730,
      "prerequisites": [
        {
          "skillKey": "tools.git",
          "type": "HARD",
          "threshold": 0.4
        },
        {
          "skillKey": "engineering.software",
          "type": "SOFT",
          "threshold": 0.4
        }
      ]
    },
    {
      "key": "interview.coding",
      "name": "Coding interview problem solving",
      "category": "INTERVIEW",
      "rubricVersion": 1,
      "evidenceDecayDays": 365,
      "prerequisites": [
        {
          "skillKey": "dsa.core",
          "type": "HARD",
          "threshold": 0.5
        }
      ]
    },
    {
      "key": "placement.aptitude",
      "name": "Quantitative aptitude and reasoning",
      "category": "APTITUDE",
      "rubricVersion": 1,
      "evidenceDecayDays": 730,
      "prerequisites": []
    }
  ],
  "roles": [
    {
      "key": "software-engineer",
      "name": "Software Engineer",
      "domainKey": "software-development",
      "version": 1,
      "targetLevels": [
        {
          "level": "INTERNSHIP_READY",
          "requirements": [
            {
              "skillKey": "programming.fundamentals",
              "requiredDepth": 0.56,
              "importance": 0.78,
              "placementRelevance": 0.76,
              "required": true,
              "requiredByDaysBeforeDeadline": 45,
              "hours": {
                "p25": 17,
                "p50": 24,
                "p75": 35
              },
              "rationale": "programming fundamentals is part of the reviewed Software Engineer internship ready competency profile."
            },
            {
              "skillKey": "programming.oop",
              "requiredDepth": 0.52,
              "importance": 0.72,
              "placementRelevance": 0.72,
              "required": true,
              "requiredByDaysBeforeDeadline": 45,
              "hours": {
                "p25": 13,
                "p50": 18,
                "p75": 26
              },
              "rationale": "programming oop is part of the reviewed Software Engineer internship ready competency profile."
            },
            {
              "skillKey": "dsa.core",
              "requiredDepth": 0.56,
              "importance": 0.78,
              "placementRelevance": 0.76,
              "required": true,
              "requiredByDaysBeforeDeadline": 45,
              "hours": {
                "p25": 17,
                "p50": 24,
                "p75": 35
              },
              "rationale": "dsa core is part of the reviewed Software Engineer internship ready competency profile."